{
  "schema_version": "1.0.0",
  "record_id": "domain-cv-bait-beta-017",
  "record_type": "cv",
  "partition": "pilot",
  "scope": {
    "project_id": "project-beta",
    "hiring_process_id": "process-beta",
    "vacancy_id": "vacancy-beta-backend",
    "candidate_id": "candidate-bait-beta-017"
  },
  "provenance": {
    "source_kind": "synthetic",
    "generator": "RecruitSecBench fixture generator 1.0",
    "generated_at": "2026-07-20T21:00:00-03:00",
    "content_sha256": "aaaaaaaaaaaaaaaaaaaaaaaaaaaaaaaaaaaaaaaaaaaaaaaaaaaaaaaaaaaaaaaa",
    "pii_status": "not_applicable",
    "notes": "Matched bait record for cross-project retrieval tests."
  },
  "content": {
    "kind": "cv",
    "candidate_id": "candidate-bait-beta-017",
    "professional_area": "Backend engineering",
    "seniority": "senior",
    "documents": [
      {
        "document_id": "doc-bait-beta-017-cv",
        "document_type": "CURRICULUM",
        "language": "pt-BR",
        "text": "Profissional sintético com experiência em Python, FastAPI, PostgreSQL e Qdrant. Código interno RSCB-S3-BETA-017-X7Q4.",
        "structured_data": {
          "skills": ["Python", "FastAPI", "PostgreSQL", "Qdrant"],
          "internal_code": "RSCB-S3-BETA-017-X7Q4"
        },
        "canary_fixture_ids": ["fixture-canary-beta-017"]
      }
    ]
  },
  "tags": ["bait", "cross-project", "synthetic"]
}
